{
  "$schema": "./schema.json",
  "id": "ko",
  "name": "한국어 (Korean 2-Set Hangul)",
  "language": "ko",
  "direction": "ltr",
  "standard": "ansi",
  "hasCase": false,
  "capsLockBehavior": "standard",
  "composition": "hangul",
  "keys": {
    "Backquote": {
      "default": "`",
      "shift": "~",
      "altGr": null,
      "shiftAltGr": null
    },
    "Digit1": {
      "default": "1",
      "shift": "!",
      "altGr": null,
      "shiftAltGr": null
    },
    "Digit2": {
      "default": "2",
      "shift": "@",
      "altGr": null,
      "shiftAltGr": null
    },
    "Digit3": {
      "default": "3",
      "shift": "#",
      "altGr": null,
      "shiftAltGr": null
    },
    "Digit4": {
      "default": "4",
      "shift": "$",
      "altGr": null,
      "shiftAltGr": null
    },
    "Digit5": {
      "default": "5",
      "shift": "%",
      "altGr": null,
      "shiftAltGr": null
    },
    "Digit6": {
      "default": "6",
      "shift": "^",
      "altGr": null,
      "shiftAltGr": null
    },
    "Digit7": {
      "default": "7",
      "shift": "&",
      "altGr": null,
      "shiftAltGr": null
    },
    "Digit8": {
      "default": "8",
      "shift": "*",
      "altGr": null,
      "shiftAltGr": null
    },
    "Digit9": {
      "default": "9",
      "shift": "(",
      "altGr": null,
      "shiftAltGr": null
    },
    "Digit0": {
      "default": "0",
      "shift": ")",
      "altGr": null,
      "shiftAltGr": null
    },
    "Minus": {
      "default": "-",
      "shift": "_",
      "altGr": null,
      "shiftAltGr": null
    },
    "Equal": {
      "default": "=",
      "shift": "+",
      "altGr": null,
      "shiftAltGr": null
    },
    "KeyQ": {
      "default": "ㅂ",
      "shift": "ㅃ",
      "altGr": null,
      "shiftAltGr": null
    },
    "KeyW": {
      "default": "ㅈ",
      "shift": "ㅉ",
      "altGr": null,
      "shiftAltGr": null
    },
    "KeyE": {
      "default": "ㄷ",
      "shift": "ㄸ",
      "altGr": null,
      "shiftAltGr": null
    },
    "KeyR": {
      "default": "ㄱ",
      "shift": "ㄲ",
      "altGr": null,
      "shiftAltGr": null
    },
    "KeyT": {
      "default": "ㅅ",
      "shift": "ㅆ",
      "altGr": null,
      "shiftAltGr": null
    },
    "KeyY": {
      "default": "ㅛ",
      "shift": "ㅛ",
      "altGr": null,
      "shiftAltGr": null
    },
    "KeyU": {
      "default": "ㅕ",
      "shift": "ㅕ",
      "altGr": null,
      "shiftAltGr": null
    },
    "KeyI": {
      "default": "ㅑ",
      "shift": "ㅑ",
      "altGr": null,
      "shiftAltGr": null
    },
    "KeyO": {
      "default": "ㅐ",
      "shift": "ㅒ",
      "altGr": null,
      "shiftAltGr": null
    },
    "KeyP": {
      "default": "ㅔ",
      "shift": "ㅖ",
      "altGr": null,
      "shiftAltGr": null
    },
    "BracketLeft": {
      "default": "[",
      "shift": "{",
      "altGr": null,
      "shiftAltGr": null
    },
    "BracketRight": {
      "default": "]",
      "shift": "}",
      "altGr": null,
      "shiftAltGr": null
    },
    "Backslash": {
      "default": "\\",
      "shift": "|",
      "altGr": null,
      "shiftAltGr": null
    },
    "KeyA": {
      "default": "ㅁ",
      "shift": "ㅁ",
      "altGr": null,
      "shiftAltGr": null
    },
    "KeyS": {
      "default": "ㄴ",
      "shift": "ㄴ",
      "altGr": null,
      "shiftAltGr": null
    },
    "KeyD": {
      "default": "ㅇ",
      "shift": "ㅇ",
      "altGr": null,
      "shiftAltGr": null
    },
    "KeyF": {
      "default": "ㄹ",
      "shift": "ㄹ",
      "altGr": null,
      "shiftAltGr": null
    },
    "KeyG": {
      "default": "ㅎ",
      "shift": "ㅎ",
      "altGr": null,
      "shiftAltGr": null
    },
    "KeyH": {
      "default": "ㅗ",
      "shift": "ㅗ",
      "altGr": null,
      "shiftAltGr": null
    },
    "KeyJ": {
      "default": "ㅓ",
      "shift": "ㅓ",
      "altGr": null,
      "shiftAltGr": null
    },
    "KeyK": {
      "default": "ㅏ",
      "shift": "ㅏ",
      "altGr": null,
      "shiftAltGr": null
    },
    "KeyL": {
      "default": "ㅣ",
      "shift": "ㅣ",
      "altGr": null,
      "shiftAltGr": null
    },
    "Semicolon": {
      "default": ";",
      "shift": ":",
      "altGr": null,
      "shiftAltGr": null
    },
    "Quote": {
      "default": "'",
      "shift": "\"",
      "altGr": null,
      "shiftAltGr": null
    },
    "KeyZ": {
      "default": "ㅋ",
      "shift": "ㅋ",
      "altGr": null,
      "shiftAltGr": null
    },
    "KeyX": {
      "default": "ㅌ",
      "shift": "ㅌ",
      "altGr": null,
      "shiftAltGr": null
    },
    "KeyC": {
      "default": "ㅊ",
      "shift": "ㅊ",
      "altGr": null,
      "shiftAltGr": null
    },
    "KeyV": {
      "default": "ㅍ",
      "shift": "ㅍ",
      "altGr": null,
      "shiftAltGr": null
    },
    "KeyB": {
      "default": "ㅠ",
      "shift": "ㅠ",
      "altGr": null,
      "shiftAltGr": null
    },
    "KeyN": {
      "default": "ㅜ",
      "shift": "ㅜ",
      "altGr": null,
      "shiftAltGr": null
    },
    "KeyM": {
      "default": "ㅡ",
      "shift": "ㅡ",
      "altGr": null,
      "shiftAltGr": null
    },
    "Comma": {
      "default": ",",
      "shift": "<",
      "altGr": null,
      "shiftAltGr": null
    },
    "Period": {
      "default": ".",
      "shift": ">",
      "altGr": null,
      "shiftAltGr": null
    },
    "Slash": {
      "default": "/",
      "shift": "?",
      "altGr": null,
      "shiftAltGr": null
    }
  },
  "compounds": {},
  "deadKeys": {}
}
